{
  "entries": [
    {
      "bundle_digest": "9ef1d35f8d29f9112b5fdaf08070c7b23293c5744eeed346212942e435c4406a",
      "episode_id": "synthetic-episode-001",
      "generation": 42,
      "observed_at_unix_ms": 1700000000000,
      "run_id": "synthetic-run-001",
      "sequence": 1,
      "source_state_id": "map-state-42",
      "trajectory_id": "synthetic-trajectory-001"
    }
  ],
  "feed_version": "sts2.map-feed-v1",
  "head": "9ef1d35f8d29f9112b5fdaf08070c7b23293c5744eeed346212942e435c4406a",
  "sequence": 1
}
